[
  {
    "track_id": "lead_vocal",
    "name": "Lead Vocal",
    "file": "fixtures/vocal_chop_groove/stems/Lead Vocal.wav",
    "source_kind": "comped_audio_track",
    "confidence": 0.95,
    "editable_domains": [
      "gain",
      "eq",
      "dynamics",
      "reverb_send",
      "automation",
      "region_editing",
      "fade"
    ],
    "not_editable_directly": [],
    "requires_render_for_analysis": false,
    "evidence": {
      "manifest_hint": "comped_audio_track"
    },
    "warnings": []
  },
  {
    "track_id": "bgv_chop",
    "name": "BGV Chop",
    "file": "fixtures/vocal_chop_groove/stems/BGV Chop.wav",
    "source_kind": "one_shot_sample",
    "confidence": 0.95,
    "editable_domains": [
      "gain",
      "eq",
      "dynamics",
      "reverb_send",
      "automation",
      "region_editing",
      "fade",
      "stereo_width",
      "pitch_shift",
      "time_stretch",
      "chop",
      "reverse"
    ],
    "not_editable_directly": [],
    "requires_render_for_analysis": false,
    "evidence": {
      "manifest_hint": "one_shot_sample"
    },
    "warnings": [
      "Imported loop/sample: verify it is not accepted at full width in the foreground by default. Re-contextualise into the song's depth and tone."
    ]
  },
  {
    "track_id": "backing_vocals_stack",
    "name": "Backing Vocals Stack",
    "file": "fixtures/vocal_chop_groove/stems/Backing Vocals Stack.wav",
    "source_kind": "comped_audio_track",
    "confidence": 0.95,
    "editable_domains": [
      "gain",
      "eq",
      "dynamics",
      "reverb_send",
      "automation",
      "region_editing",
      "fade"
    ],
    "not_editable_directly": [],
    "requires_render_for_analysis": false,
    "evidence": {
      "manifest_hint": "comped_audio_track"
    },
    "warnings": []
  },
  {
    "track_id": "electric_guitar",
    "name": "Electric Guitar",
    "file": "fixtures/vocal_chop_groove/stems/Electric Guitar.wav",
    "source_kind": "live_audio_recording",
    "confidence": 0.55,
    "editable_domains": [
      "gain",
      "eq",
      "dynamics",
      "reverb_send",
      "automation",
      "region_editing",
      "fade"
    ],
    "not_editable_directly": [],
    "requires_render_for_analysis": false,
    "evidence": {
      "filename_clue": "live-instrument name"
    },
    "warnings": []
  },
  {
    "track_id": "kick",
    "name": "Kick",
    "file": "fixtures/vocal_chop_groove/stems/Kick.wav",
    "source_kind": "live_audio_recording",
    "confidence": 0.55,
    "editable_domains": [
      "gain",
      "eq",
      "dynamics",
      "reverb_send",
      "automation",
      "region_editing",
      "fade"
    ],
    "not_editable_directly": [],
    "requires_render_for_analysis": false,
    "evidence": {
      "filename_clue": "live-instrument name"
    },
    "warnings": []
  },
  {
    "track_id": "snare",
    "name": "Snare",
    "file": "fixtures/vocal_chop_groove/stems/Snare.wav",
    "source_kind": "live_audio_recording",
    "confidence": 0.55,
    "editable_domains": [
      "gain",
      "eq",
      "dynamics",
      "reverb_send",
      "automation",
      "region_editing",
      "fade"
    ],
    "not_editable_directly": [],
    "requires_render_for_analysis": false,
    "evidence": {
      "filename_clue": "live-instrument name"
    },
    "warnings": []
  }
]
